{
  "metadata": {
    "scenario_id": "terawatt_stress_2026",
    "title": "One-terawatt 2026 stress test",
    "version": "0.1.0",
    "created_by": "Terafab Decision Twin v1"
  },
  "time": {
    "start_year": 2026,
    "end_year": 2026,
    "time_step": "annual"
  },
  "terafab_phase": {
    "phase": {
      "value": "concept",
      "unit": "category",
      "status": "assumption",
      "source": "scenario author",
      "rationale": "Declared scenario input; not a verified Terafab operating fact."
    },
    "one_terawatt_treatment": {
      "value": "stress_test_only",
      "unit": "category",
      "status": "stress_test_assumption",
      "source": "scenario author",
      "rationale": "1 TW is a stress-test assumption, not a verified Terafab operating fact."
    }
  },
  "energy": {
    "site_electric_load_MW": {
      "value": 1000000,
      "unit": "MW",
      "status": "stress_test_assumption",
      "source": "scenario author",
      "rationale": "Declared one-terawatt electrical-load stress test; not verified site load."
    },
    "load_factor": {
      "value": 0.85,
      "unit": "fraction",
      "status": "assumption",
      "source": "scenario author",
      "rationale": "Declared scenario input; not a verified Terafab operating fact."
    },
    "firm_capacity_MW": {
      "value": 1200000,
      "unit": "MW",
      "status": "stress_test_assumption",
      "source": "scenario author",
      "rationale": "Stress-test firm capacity assumption."
    },
    "reserve_margin_fraction": {
      "value": 0.15,
      "unit": "fraction",
      "status": "assumption",
      "source": "scenario author",
      "rationale": "Declared scenario input; not a verified Terafab operating fact."
    },
    "grid_carbon_intensity_kg_per_MWh": {
      "value": 350,
      "unit": "kg/MWh",
      "status": "assumption",
      "source": "scenario author",
      "rationale": "Declared scenario input; not a verified Terafab operating fact."
    }
  },
  "cooling": {
    "heat_rejection_capacity_MW": {
      "value": 1020000,
      "unit": "MW",
      "status": "stress_test_assumption",
      "source": "scenario author",
      "rationale": "Stress-test heat-rejection capacity assumption required by first-law gate."
    },
    "heat_rejection_fraction": {
      "value": 0.98,
      "unit": "fraction",
      "status": "assumption",
      "source": "scenario author",
      "rationale": "Declared scenario input; not a verified Terafab operating fact."
    },
    "waste_heat_MW": {
      "value": 5,
      "unit": "MW",
      "status": "assumption",
      "source": "scenario author",
      "rationale": "Declared scenario input; not a verified Terafab operating fact."
    },
    "cop": {
      "value": 6.0,
      "unit": "ratio",
      "status": "assumption",
      "source": "scenario author",
      "rationale": "Declared scenario input; not a verified Terafab operating fact."
    },
    "hot_reservoir_K": {
      "value": 315,
      "unit": "K",
      "status": "assumption",
      "source": "scenario author",
      "rationale": "Declared scenario input; not a verified Terafab operating fact."
    },
    "cold_reservoir_K": {
      "value": 298.15,
      "unit": "K",
      "status": "assumption",
      "source": "scenario author",
      "rationale": "Declared scenario input; not a verified Terafab operating fact."
    },
    "ambient_temperature_K": {
      "value": 298.15,
      "unit": "K",
      "status": "assumption",
      "source": "scenario author",
      "rationale": "Declared scenario input; not a verified Terafab operating fact."
    }
  },
  "water": {
    "withdrawal_m3_per_MWh": {
      "value": 1.2,
      "unit": "m3/MWh",
      "status": "assumption",
      "source": "scenario author",
      "rationale": "Declared scenario input; not a verified Terafab operating fact."
    },
    "consumptive_fraction": {
      "value": 0.65,
      "unit": "fraction",
      "status": "assumption",
      "source": "scenario author",
      "rationale": "Declared scenario input; not a verified Terafab operating fact."
    },
    "wastewater_fraction": {
      "value": 0.35,
      "unit": "fraction",
      "status": "assumption",
      "source": "scenario author",
      "rationale": "Declared scenario input; not a verified Terafab operating fact."
    },
    "permit_withdrawal_m3_per_day": {
      "value": 3500000,
      "unit": "m3/day",
      "status": "stress_test_assumption",
      "source": "scenario author",
      "rationale": "Stress-test permit capacity; not a verified permit."
    },
    "permit_discharge_m3_per_day": {
      "value": 1500000,
      "unit": "m3/day",
      "status": "stress_test_assumption",
      "source": "scenario author",
      "rationale": "Stress-test discharge permit; not verified."
    },
    "upw_m3_per_wafer": {
      "value": 0.08,
      "unit": "m3/wafer",
      "status": "assumption",
      "source": "scenario author",
      "rationale": "Declared scenario input; not a verified Terafab operating fact."
    }
  },
  "manufacturing": {
    "wafer_starts_per_month": {
      "value": 4000000,
      "unit": "wafers/month",
      "status": "stress_test_assumption",
      "source": "scenario author",
      "rationale": "Stress-test manufacturing scale; not verified."
    },
    "die_per_wafer": {
      "value": 600,
      "unit": "die/wafer",
      "status": "assumption",
      "source": "scenario author",
      "rationale": "Declared scenario input; not a verified Terafab operating fact."
    },
    "baseline_yield": {
      "value": 0.72,
      "unit": "fraction",
      "status": "assumption",
      "source": "scenario author",
      "rationale": "Declared scenario input; not a verified Terafab operating fact."
    },
    "learning_rate_per_year": {
      "value": 0.02,
      "unit": "fraction/year",
      "status": "assumption",
      "source": "scenario author",
      "rationale": "Declared scenario input; not a verified Terafab operating fact."
    },
    "contamination_loss_fraction": {
      "value": 0.03,
      "unit": "fraction",
      "status": "assumption",
      "source": "scenario author",
      "rationale": "Declared scenario input; not a verified Terafab operating fact."
    },
    "qualification_readiness": {
      "value": 0.82,
      "unit": "fraction",
      "status": "assumption",
      "source": "scenario author",
      "rationale": "Declared scenario input; not a verified Terafab operating fact."
    },
    "contamination_readiness": {
      "value": 0.78,
      "unit": "fraction",
      "status": "assumption",
      "source": "scenario author",
      "rationale": "Declared scenario input; not a verified Terafab operating fact."
    },
    "packaging_readiness": {
      "value": 0.8,
      "unit": "fraction",
      "status": "assumption",
      "source": "scenario author",
      "rationale": "Declared scenario input; not a verified Terafab operating fact."
    },
    "compute_watts_per_good_die": {
      "value": 250,
      "unit": "W/die",
      "status": "assumption",
      "source": "scenario author",
      "rationale": "Declared scenario input; not a verified Terafab operating fact."
    }
  },
  "economics": {
    "electricity_price_USD_per_MWh": {
      "value": 75,
      "unit": "USD/MWh",
      "status": "assumption",
      "source": "scenario author",
      "rationale": "Declared scenario input; not a verified Terafab operating fact."
    },
    "water_price_USD_per_m3": {
      "value": 1.5,
      "unit": "USD/m3",
      "status": "assumption",
      "source": "scenario author",
      "rationale": "Declared scenario input; not a verified Terafab operating fact."
    },
    "capex_USD": {
      "value": 1000000000000,
      "unit": "USD",
      "status": "stress_test_assumption",
      "source": "scenario author",
      "rationale": "Stress-test capex assumption; not verified."
    },
    "annual_fixed_opex_USD": {
      "value": 400000000,
      "unit": "USD/year",
      "status": "assumption",
      "source": "scenario author",
      "rationale": "Declared scenario input; not a verified Terafab operating fact."
    },
    "discount_rate": {
      "value": 0.08,
      "unit": "fraction",
      "status": "assumption",
      "source": "scenario author",
      "rationale": "Declared scenario input; not a verified Terafab operating fact."
    },
    "asset_life_years": {
      "value": 20,
      "unit": "years",
      "status": "assumption",
      "source": "scenario author",
      "rationale": "Declared scenario input; not a verified Terafab operating fact."
    },
    "incentive_public_USD": {
      "value": 1500000000,
      "unit": "USD",
      "status": "assumption",
      "source": "scenario author",
      "rationale": "Declared scenario input; not a verified Terafab operating fact."
    }
  },
  "governance": {
    "partner_count": {
      "value": 3,
      "unit": "count",
      "status": "assumption",
      "source": "scenario author",
      "rationale": "Declared scenario input; not a verified Terafab operating fact."
    },
    "governance_complexity_index": {
      "value": 0.35,
      "unit": "index",
      "status": "assumption",
      "source": "scenario author",
      "rationale": "Declared scenario input; not a verified Terafab operating fact."
    },
    "decision_latency_months": {
      "value": 6,
      "unit": "months",
      "status": "assumption",
      "source": "scenario author",
      "rationale": "Declared scenario input; not a verified Terafab operating fact."
    }
  },
  "policy": {
    "jobs_created": {
      "value": 4500,
      "unit": "jobs",
      "status": "assumption",
      "source": "scenario author",
      "rationale": "Declared scenario input; not a verified Terafab operating fact."
    },
    "domestic_supply_security_index": {
      "value": 0.7,
      "unit": "index",
      "status": "assumption",
      "source": "scenario author",
      "rationale": "Declared scenario input; not a verified Terafab operating fact."
    },